{
  "questionId": "question-601",
  "title": "Will heavy rain disrupt last-mile delivery operations in Warsaw on 2026-06-03?",
  "background": "Generated by the auto-evidence fixture-replay forecast path for the selected weather-logistics wedge.",
  "domain": "weather-logistics",
  "outputType": "binary",
  "status": "resolved",
  "openAt": "2026-06-02T10:00:00Z",
  "closeAt": "2026-06-03T00:00:00Z",
  "resolveAt": "2026-06-04T12:00:00Z",
  "horizon": {
    "startsAt": "2026-06-03T00:00:00Z",
    "endsAt": "2026-06-03T23:59:59Z",
    "label": "1-day"
  },
  "resolutionCriteria": "Resolve Yes if the declared operations source reports at least one weather-coded delivery disruption in Warsaw on 2026-06-03 and the declared weather observation source records daily precipitation of at least 20 millimeters. Resolve No otherwise.",
  "resolutionAuthority": "OPE prototype resolver",
  "resolutionMode": "automated_measurement",
  "primaryResolutionSource": {
    "sourceId": "source-402",
    "name": "Declared Warsaw operations event source",
    "sourceType": "internal_dataset"
  },
  "fallbackResolutionSources": [
    {
      "sourceId": "source-403",
      "name": "Open-Meteo weather observation for Warsaw",
      "sourceType": "public_dataset"
    }
  ],
  "validOutcomeSpace": {
    "description": "Binary outcome: Yes if disruption and precipitation criteria are both satisfied; No otherwise.",
    "labels": [
      "yes",
      "no"
    ]
  },
  "clarificationHistory": [],
  "incentiveRiskReview": {
    "riskLevel": "minimal",
    "notes": "Auto-evidence fixture-replay forecast with no live fetch or private operational data."
  },
  "createdAt": "2026-06-02T10:00:00Z",
  "updatedAt": "2026-06-04T12:10:00Z"
}
