{
  "questionId": "question-301",
  "title": "Will heavy rain disrupt last-mile delivery operations in Warsaw on 2026-06-05?",
  "background": "Generated by the fixture-only evidence loop for the selected weather-logistics wedge.",
  "domain": "weather-logistics",
  "outputType": "binary",
  "status": "annulled",
  "openAt": "2026-06-03T00:00:00Z",
  "closeAt": "2026-06-04T18:00:00Z",
  "resolveAt": "2026-06-06T12:00:00Z",
  "horizon": {
    "startsAt": "2026-06-05T00:00:00Z",
    "endsAt": "2026-06-05T23:59:59Z",
    "label": "1-day"
  },
  "resolutionCriteria": "Resolve Yes if the declared operations fixture reports at least one weather-coded delivery disruption in Warsaw on 2026-06-05 and the weather fixture records daily precipitation of at least 20 millimeters. Resolve No otherwise.",
  "resolutionAuthority": "OPE fixture resolver",
  "resolutionMode": "automated_measurement",
  "primaryResolutionSource": {
    "sourceId": "source-301",
    "name": "Warsaw logistics operations fixture",
    "sourceType": "internal_dataset",
    "uri": "https://example.test/fixtures/source/warsaw-logistics-2026-06-05.json",
    "retrievedAt": "2026-06-06T09:00:00Z",
    "contentHash": "sha256-ops-source-301"
  },
  "fallbackResolutionSources": [
    {
      "sourceId": "source-304",
      "name": "Warsaw weather observation fixture",
      "sourceType": "internal_dataset",
      "uri": "https://example.test/fixtures/source/warsaw-weather-observation-2026-06-05.json",
      "retrievedAt": "2026-06-06T09:00:00Z",
      "contentHash": "sha256-weather-observation-source-301"
    }
  ],
  "validOutcomeSpace": {
    "description": "Binary outcome: Yes if the disruption and precipitation conditions are both satisfied; No otherwise.",
    "labels": [
      "yes",
      "no"
    ]
  },
  "clarificationHistory": [],
  "incentiveRiskReview": {
    "riskLevel": "minimal",
    "notes": "Synthetic fixture data with no live operational exposure."
  },
  "createdAt": "2026-06-03T00:00:00Z",
  "updatedAt": "2026-06-06T10:00:00Z"
}
