{
  "questionId": "question-902",
  "title": "Will heavy rain disrupt last-mile delivery operations in Warsaw on 2026-06-03?",
  "background": "Generated by setup-aware forecast execution from accepted source intake and setup method decision records.",
  "domain": "weather-logistics",
  "outputType": "binary",
  "status": "open",
  "openAt": "2026-06-02T10:30:00Z",
  "closeAt": "2026-06-02T12:00:00Z",
  "resolveAt": "2026-06-04T12:00:00Z",
  "horizon": {
    "startsAt": "2026-06-03T00:00:00Z",
    "endsAt": "2026-06-03T23:59:59Z",
    "label": "1-day"
  },
  "resolutionCriteria": "Resolve Yes if the declared operations source reports at least one weather-coded delivery disruption in Warsaw on 2026-06-03 and the declared weather observation source records daily precipitation of at least 20 millimeters. Resolve No otherwise.",
  "resolutionAuthority": "OPE prototype resolver",
  "resolutionMode": "automated_measurement",
  "primaryResolutionSource": {
    "sourceId": "manifestsource-005",
    "name": "Declared Outcome Placeholder",
    "sourceType": "internal_dataset",
    "uri": "local://fixtures/weather-logistics/outcome-placeholder.csv",
    "contentHash": "hash-outcome-partial-001"
  },
  "fallbackResolutionSources": [],
  "validOutcomeSpace": {
    "description": "Binary outcome: Yes if declared operations outcome says disruption_observed is true; No otherwise.",
    "labels": [
      "yes",
      "no"
    ]
  },
  "clarificationHistory": [],
  "incentiveRiskReview": {
    "riskLevel": "minimal",
    "notes": "Setup-aware fixture forecast with no network access, live fetch, local live draft, or private-source runtime."
  },
  "createdAt": "2026-06-02T10:30:00Z",
  "updatedAt": "2026-06-02T10:30:00Z"
}
